{
  "$schema": "./schema/architecture.schema.json",
  "principle": "Choose services from requirements: latency, throughput, consistency, durability, availability, compliance, operational effort, and cost. Popularity is not a requirement.",
  "answer_format": "Because the requirement is X, I choose A over B. The request flows through these steps. The main tradeoff is this. I would secure it with that, and validate it by measuring this.",
  "source_note": "Condensed from your SAA-C03 quick reference and rewritten for speaking practice. Verify current Region availability, quotas, and pricing before a real design.",
  "families": [
    {
      "name": "Global entry and delivery",
      "cat": "edge",
      "services": [
        {
          "name": "Route 53",
          "role": "DNS, health checks, routing policies"
        },
        {
          "name": "CloudFront",
          "role": "Edge cache and CDN"
        },
        {
          "name": "Global Accelerator",
          "role": "Static anycast IPs, AWS backbone routing"
        }
      ]
    },
    {
      "name": "Compute",
      "cat": "compute",
      "services": [
        {
          "name": "EC2",
          "role": "Virtual machines"
        },
        {
          "name": "Auto Scaling",
          "role": "Adds and removes capacity"
        },
        {
          "name": "ELB (ALB, NLB)",
          "role": "Spreads traffic across targets"
        },
        {
          "name": "Lambda",
          "role": "Event-driven functions"
        },
        {
          "name": "Elastic Beanstalk",
          "role": "Managed app deployment"
        }
      ]
    },
    {
      "name": "Containers",
      "cat": "container",
      "services": [
        {
          "name": "ECS",
          "role": "AWS-native container orchestration"
        },
        {
          "name": "EKS",
          "role": "Managed Kubernetes control plane"
        },
        {
          "name": "Fargate",
          "role": "Serverless compute for ECS and EKS"
        },
        {
          "name": "ECR",
          "role": "Container image registry"
        }
      ]
    },
    {
      "name": "Storage",
      "cat": "storage",
      "services": [
        {
          "name": "S3",
          "role": "Durable object storage and data lake"
        },
        {
          "name": "EBS",
          "role": "Block volumes for EC2"
        },
        {
          "name": "EFS",
          "role": "Shared NFS file system"
        },
        {
          "name": "FSx",
          "role": "Windows, Lustre, ONTAP, OpenZFS"
        },
        {
          "name": "Storage Gateway",
          "role": "Hybrid file, volume, tape"
        },
        {
          "name": "Snow Family",
          "role": "Offline transfer and edge"
        }
      ]
    },
    {
      "name": "Databases",
      "cat": "database",
      "services": [
        {
          "name": "RDS",
          "role": "Managed relational database"
        },
        {
          "name": "Aurora",
          "role": "AWS relational engine, MySQL and PostgreSQL compatible"
        },
        {
          "name": "DynamoDB",
          "role": "Serverless key-value and document"
        },
        {
          "name": "ElastiCache",
          "role": "In-memory cache"
        },
        {
          "name": "Redshift",
          "role": "Analytical warehouse"
        },
        {
          "name": "OpenSearch",
          "role": "Search and log analytics"
        }
      ]
    },
    {
      "name": "Network and hybrid",
      "cat": "edge",
      "services": [
        {
          "name": "VPC, subnets, route tables",
          "role": "Isolated network and placement"
        },
        {
          "name": "Security groups",
          "role": "Stateful firewall on resources"
        },
        {
          "name": "Network ACLs",
          "role": "Stateless subnet filter"
        },
        {
          "name": "NAT gateway",
          "role": "Outbound IPv4 for private subnets"
        },
        {
          "name": "VPN, Direct Connect",
          "role": "Hybrid connectivity"
        },
        {
          "name": "PrivateLink",
          "role": "Private access to services"
        }
      ]
    },
    {
      "name": "Identity and security",
      "cat": "security",
      "services": [
        {
          "name": "IAM",
          "role": "Identities, policies, roles"
        },
        {
          "name": "IAM Identity Center",
          "role": "Workforce single sign-on"
        },
        {
          "name": "KMS",
          "role": "Encryption keys"
        },
        {
          "name": "Secrets Manager",
          "role": "Stores and rotates secrets"
        },
        {
          "name": "ACM",
          "role": "TLS certificates"
        },
        {
          "name": "WAF, Shield",
          "role": "Web filtering, DDoS protection"
        },
        {
          "name": "GuardDuty",
          "role": "Threat detection"
        },
        {
          "name": "CloudTrail",
          "role": "API audit trail"
        }
      ]
    },
    {
      "name": "Integration and workflow",
      "cat": "integration",
      "services": [
        {
          "name": "SQS",
          "role": "Durable queue and buffer"
        },
        {
          "name": "SNS",
          "role": "Pub/sub fan-out"
        },
        {
          "name": "EventBridge",
          "role": "Event bus, rules, schedules"
        },
        {
          "name": "Step Functions",
          "role": "Workflow orchestration"
        },
        {
          "name": "API Gateway",
          "role": "Managed APIs"
        },
        {
          "name": "Amazon MQ",
          "role": "Managed ActiveMQ and RabbitMQ"
        }
      ]
    },
    {
      "name": "Streaming and analytics",
      "cat": "analytics",
      "services": [
        {
          "name": "Kinesis Data Streams",
          "role": "Real-time stream with replay"
        },
        {
          "name": "Data Firehose",
          "role": "Managed delivery to destinations"
        },
        {
          "name": "Glue",
          "role": "Catalog and ETL"
        },
        {
          "name": "Athena",
          "role": "SQL on S3"
        },
        {
          "name": "Lake Formation",
          "role": "Data lake permissions"
        },
        {
          "name": "EMR",
          "role": "Spark and Hadoop frameworks"
        },
        {
          "name": "Quick Sight",
          "role": "BI dashboards"
        }
      ]
    },
    {
      "name": "AI, ML and media",
      "cat": "ml",
      "services": [
        {
          "name": "Bedrock",
          "role": "Foundation-model applications"
        },
        {
          "name": "SageMaker",
          "role": "Build, train, deploy custom ML"
        },
        {
          "name": "Textract",
          "role": "Document extraction"
        },
        {
          "name": "Comprehend",
          "role": "Text analysis"
        },
        {
          "name": "Rekognition",
          "role": "Image and video analysis"
        },
        {
          "name": "Transcribe, Polly",
          "role": "Speech to text, text to speech"
        },
        {
          "name": "MediaConvert",
          "role": "File-based video transcoding"
        }
      ]
    },
    {
      "name": "Operations and governance",
      "cat": "mgmt",
      "services": [
        {
          "name": "CloudWatch",
          "role": "Metrics, logs, alarms"
        },
        {
          "name": "AWS Config",
          "role": "Configuration history and rules"
        },
        {
          "name": "Systems Manager",
          "role": "Fleet operations and runbooks"
        },
        {
          "name": "CloudFormation",
          "role": "Infrastructure as code"
        },
        {
          "name": "Organizations, Control Tower",
          "role": "Multi-account governance"
        },
        {
          "name": "AWS Backup",
          "role": "Central backup policies"
        }
      ]
    }
  ],
  "heuristics": [
    {
      "need": "Static content for global users",
      "choose": "S3 + CloudFront"
    },
    {
      "need": "Relational transactions",
      "choose": "RDS or Aurora"
    },
    {
      "need": "Key-value access at scale",
      "choose": "DynamoDB"
    },
    {
      "need": "Decouple producers from slow work",
      "choose": "SQS"
    },
    {
      "need": "One event, many independent consumers",
      "choose": "SNS + SQS or EventBridge"
    },
    {
      "need": "Ordered, replayable stream",
      "choose": "Kinesis Data Streams"
    },
    {
      "need": "SQL over files in S3",
      "choose": "Athena"
    },
    {
      "need": "Containers without managing nodes",
      "choose": "ECS or EKS on Fargate"
    },
    {
      "need": "Multi-step workflow with retries and waits",
      "choose": "Step Functions"
    },
    {
      "need": "Who changed what in the account",
      "choose": "CloudTrail"
    },
    {
      "need": "Generative AI without hosting models",
      "choose": "Bedrock"
    },
    {
      "need": "Private access to an AWS service",
      "choose": "VPC endpoint or PrivateLink"
    }
  ],
  "tables": [
    {
      "id": "compute",
      "title": "Compute and hosting",
      "cat": "compute",
      "rows": [
        {
          "service": "EC2",
          "use": "You need OS or runtime control, legacy software, custom agents, or special instance types.",
          "tradeoff": "You patch and manage capacity."
        },
        {
          "service": "Lambda",
          "use": "Short event or API handlers that scale automatically and bill per request.",
          "tradeoff": "15-minute limit, concurrency limits, stateless execution, cold starts."
        },
        {
          "service": "ECS",
          "use": "AWS-native container scheduling with simple AWS integration.",
          "tradeoff": "AWS-specific orchestration model."
        },
        {